{
  "run_id": "local-20260911T060925Z-e67c107a",
  "status": "failed",
  "profile": "qwen36",
  "base_url": "http://127.0.0.1:8084/v1",
  "model": "qwen3.6-27b",
  "config_hash": "51458e4a784973a031dfb6c33948b821fc7dc2427a9f2e3cffc9bb24d64e7ebb",
  "comparison_config_hash": "6ccc4b0648b6e27df69da4c647388f44bd49c31f9d172107039a65159989bfde",
  "input_sha256": "6a49d0ab3fa58896cbe2c79c909e6f7b95390573ffdc88d5e63235b213eb56a9",
  "started_at": "2026-09-11T06:09:25.682777Z",
  "finished_at": "2026-09-11T06:10:08.846456Z",
  "elapsed_seconds": 43.165,
  "stages": [
    {
      "name": "test_model__core",
      "elapsed_seconds": 12.396,
      "repairs": 0,
      "schema_valid": true,
      "usage": {
        "completion_tokens": 440,
        "prompt_tokens": 1874,
        "total_tokens": 2314
      }
    },
    {
      "name": "test_model__state_models",
      "elapsed_seconds": 30.724,
      "repairs": 1,
      "schema_valid": false,
      "usage": {
        "completion_tokens": 945,
        "prompt_tokens": 4271,
        "total_tokens": 5216
      }
    }
  ],
  "artifacts": {
    "feature_spec": {
      "path": "feature_spec.json",
      "sha256": "33b78d9438fef631d80b3f763f669623d04eaa1bcbd33461b04c73dfa02097ee",
      "schema_valid": true
    }
  },
  "generation_mode": "batched",
  "design_status": "blocked",
  "call_records": [
    {
      "stage": "test_model__core",
      "repair": false,
      "estimated_input_tokens": 8576,
      "max_output_tokens": 3500,
      "outcome": "succeeded",
      "elapsed_seconds": 12.396,
      "prompt_tokens": 1874,
      "completion_tokens": 440,
      "total_tokens": 2314,
      "usage_status": "reported",
      "accounted_tokens": 2314,
      "finish_reason": "stop",
      "model": "qwen3.6-27b"
    },
    {
      "stage": "test_model__state_models",
      "repair": false,
      "estimated_input_tokens": 8226,
      "max_output_tokens": 3500,
      "outcome": "invalid_artifact",
      "elapsed_seconds": 17.624,
      "prompt_tokens": 1863,
      "completion_tokens": 571,
      "total_tokens": 2434,
      "usage_status": "reported",
      "accounted_tokens": 2434,
      "finish_reason": "stop",
      "model": "qwen3.6-27b"
    },
    {
      "stage": "test_model__state_models_repair",
      "repair": true,
      "estimated_input_tokens": 10231,
      "max_output_tokens": 3500,
      "outcome": "invalid_artifact",
      "elapsed_seconds": 13.1,
      "prompt_tokens": 2408,
      "completion_tokens": 374,
      "total_tokens": 2782,
      "usage_status": "reported",
      "accounted_tokens": 2782,
      "finish_reason": "stop",
      "model": "qwen3.6-27b"
    }
  ],
  "usage_summary": {
    "calls": 3,
    "repair_calls": 1,
    "unreported_calls": 0,
    "prompt_tokens": 6145,
    "completion_tokens": 1385,
    "total_tokens": 7530,
    "reported_total_tokens": 7530,
    "accounted_tokens": 7530,
    "budget_tokens": 150000,
    "remaining_tokens": 142470,
    "budget_exhausted": false,
    "estimation_method": "utf8_bytes_plus_256_v1"
  },
  "stop_reason": "generation_error",
  "error": "SchemaValidationError: {'op': 'const', 'args': [{'const': True}]} is not valid under any of the given schemas; {'op': 'const', 'args': [{'const': False}]} is not valid under any of the given schemas; {'op': 'const', 'args': [{'const': False}]} is not valid under any of the given schemas; {'op': 'const', 'args': [{'const': False}]} is not valid under any of the given schemas",
  "generation": {
    "generation_run_id": "local-20260911T060925Z-e67c107a",
    "prompt_template_id": "local-design",
    "prompt_template_version": "batched-2",
    "input_sha256": "6a49d0ab3fa58896cbe2c79c909e6f7b95390573ffdc88d5e63235b213eb56a9",
    "output_schema_id": "local_run_manifest.schema.json",
    "model": {
      "provider": "openai-compatible",
      "name": "qwen3.6-27b",
      "version": null
    },
    "parameters": {
      "temperature": 0.15,
      "seed": null
    },
    "generated_at": "2026-09-11T06:09:25.682777Z",
    "review_status": "pending"
  }
}
