{
  "run_id": "local-20260911T065142Z-f87b0b38",
  "status": "succeeded",
  "profile": "qwen36",
  "base_url": "http://127.0.0.1:8084/v1",
  "model": "qwen3.6-27b",
  "config_hash": "51458e4a784973a031dfb6c33948b821fc7dc2427a9f2e3cffc9bb24d64e7ebb",
  "comparison_config_hash": "6ccc4b0648b6e27df69da4c647388f44bd49c31f9d172107039a65159989bfde",
  "input_sha256": "c9df1767a22b201de071dfaea45989011006ca01f8399ff8fe6ac4c269abb49f",
  "started_at": "2026-09-11T06:51:42.894610Z",
  "finished_at": "2026-09-11T06:54:40.675696Z",
  "elapsed_seconds": 177.786,
  "stages": [
    {
      "name": "test_model__core",
      "elapsed_seconds": 16.917,
      "repairs": 0,
      "schema_valid": true,
      "usage": {
        "completion_tokens": 531,
        "prompt_tokens": 1906,
        "total_tokens": 2437
      }
    },
    {
      "name": "test_model__state_models",
      "elapsed_seconds": 16.694,
      "repairs": 0,
      "schema_valid": true,
      "usage": {
        "completion_tokens": 534,
        "prompt_tokens": 1892,
        "total_tokens": 2426
      }
    },
    {
      "name": "test_model__decision_tables",
      "elapsed_seconds": 23.081,
      "repairs": 0,
      "schema_valid": true,
      "usage": {
        "completion_tokens": 765,
        "prompt_tokens": 1982,
        "total_tokens": 2747
      }
    },
    {
      "name": "observation_set",
      "elapsed_seconds": 24.292,
      "repairs": 0,
      "schema_valid": true,
      "usage": {
        "completion_tokens": 744,
        "prompt_tokens": 3216,
        "total_tokens": 3960
      }
    },
    {
      "name": "risk_candidates__1",
      "elapsed_seconds": 20.168,
      "repairs": 0,
      "schema_valid": true,
      "usage": {
        "completion_tokens": 612,
        "prompt_tokens": 2707,
        "total_tokens": 3319
      }
    },
    {
      "name": "manual_case_set__1",
      "elapsed_seconds": 36.117,
      "repairs": 0,
      "schema_valid": true,
      "usage": {
        "completion_tokens": 1015,
        "prompt_tokens": 6376,
        "total_tokens": 7391
      }
    },
    {
      "name": "manual_case_set__2",
      "elapsed_seconds": 24.416,
      "repairs": 0,
      "schema_valid": true,
      "usage": {
        "completion_tokens": 597,
        "prompt_tokens": 6129,
        "total_tokens": 6726
      }
    },
    {
      "name": "manual_case_review__1",
      "elapsed_seconds": 9.52,
      "repairs": 0,
      "schema_valid": true,
      "usage": {
        "completion_tokens": 177,
        "prompt_tokens": 3506,
        "total_tokens": 3683
      }
    },
    {
      "name": "manual_case_review__2",
      "elapsed_seconds": 6.054,
      "repairs": 0,
      "schema_valid": true,
      "usage": {
        "completion_tokens": 67,
        "prompt_tokens": 3300,
        "total_tokens": 3367
      }
    }
  ],
  "artifacts": {
    "feature_spec": {
      "path": "feature_spec.json",
      "sha256": "55bb04ee00fe4f9c0ae1f2b4a1f4070e09d1e289393389f4685df4b0df6f0e98",
      "schema_valid": true
    },
    "test_model": {
      "path": "test_model.json",
      "sha256": "6c6f0bdc7821142ffc13cc4851bb666f05a75fb83956dd21dc64b60f67489e3a",
      "schema_valid": true
    },
    "observation_set": {
      "path": "observation_set.json",
      "sha256": "b880dd4eb76f38d10b54b931d2e1d6c8633d7c169a383540403b96307a08e7d3",
      "schema_valid": true
    },
    "risk_register": {
      "path": "risk_register.json",
      "sha256": "a86e80afa52d64c44d3f3a9406840415b4b46c9df27d3ba654327c2825a073c7",
      "schema_valid": true
    },
    "technique_plan": {
      "path": "technique_plan.json",
      "sha256": "d3adaf6ddf042dca76c212a7518352afee966b977e6bef73a5ff8d51284be137",
      "schema_valid": true
    },
    "manual_case_set": {
      "path": "manual_case_set.json",
      "sha256": "13e08ed5da11a0772715c72894527b9c0a99e1369130a0c90e96e164b09be07a",
      "schema_valid": true
    },
    "effort_plan": {
      "path": "effort_plan.json",
      "sha256": "8827e29ed19e5ecb1819a57bb5186db0a9055644f4fe49b3c23bf37f8f5550ca",
      "schema_valid": true
    },
    "coverage_report": {
      "path": "coverage_report.json",
      "sha256": "e40e2c00b1f20ef86dc3d7adbef497da594a2863f08de2d7e101035474400c0c",
      "schema_valid": true
    },
    "gate_decision": {
      "path": "gate_decision.json",
      "sha256": "cde6c28967d417457e5770bfb5d5c229259acda8b848d4185bacbb0ebebc81b7",
      "schema_valid": true
    },
    "release_brief": {
      "path": "release_brief.json",
      "sha256": "fa451d985ea95bb0784a68d9aefc6a91610b60ba010c747abb054ff1ef4ead4c",
      "schema_valid": true
    }
  },
  "generation_mode": "batched",
  "design_status": "degraded",
  "call_records": [
    {
      "stage": "test_model__core",
      "repair": false,
      "estimated_input_tokens": 8906,
      "max_output_tokens": 3500,
      "outcome": "succeeded",
      "elapsed_seconds": 16.917,
      "prompt_tokens": 1906,
      "completion_tokens": 531,
      "total_tokens": 2437,
      "usage_status": "reported",
      "accounted_tokens": 2437,
      "finish_reason": "stop",
      "model": "qwen3.6-27b"
    },
    {
      "stage": "test_model__state_models",
      "repair": false,
      "estimated_input_tokens": 8328,
      "max_output_tokens": 3500,
      "outcome": "succeeded",
      "elapsed_seconds": 16.694,
      "prompt_tokens": 1892,
      "completion_tokens": 534,
      "total_tokens": 2426,
      "usage_status": "reported",
      "accounted_tokens": 2426,
      "finish_reason": "stop",
      "model": "qwen3.6-27b"
    },
    {
      "stage": "test_model__decision_tables",
      "repair": false,
      "estimated_input_tokens": 8819,
      "max_output_tokens": 3500,
      "outcome": "succeeded",
      "elapsed_seconds": 23.081,
      "prompt_tokens": 1982,
      "completion_tokens": 765,
      "total_tokens": 2747,
      "usage_status": "reported",
      "accounted_tokens": 2747,
      "finish_reason": "stop",
      "model": "qwen3.6-27b"
    },
    {
      "stage": "observation_set",
      "repair": false,
      "estimated_input_tokens": 13844,
      "max_output_tokens": 4500,
      "outcome": "succeeded",
      "elapsed_seconds": 24.292,
      "prompt_tokens": 3216,
      "completion_tokens": 744,
      "total_tokens": 3960,
      "usage_status": "reported",
      "accounted_tokens": 3960,
      "finish_reason": "stop",
      "model": "qwen3.6-27b"
    },
    {
      "stage": "risk_candidates__1",
      "repair": false,
      "estimated_input_tokens": 10684,
      "max_output_tokens": 3000,
      "outcome": "succeeded",
      "elapsed_seconds": 20.168,
      "prompt_tokens": 2707,
      "completion_tokens": 612,
      "total_tokens": 3319,
      "usage_status": "reported",
      "accounted_tokens": 3319,
      "finish_reason": "stop",
      "model": "qwen3.6-27b"
    },
    {
      "stage": "manual_case_set__1",
      "repair": false,
      "estimated_input_tokens": 26513,
      "max_output_tokens": 4000,
      "outcome": "succeeded",
      "elapsed_seconds": 36.117,
      "prompt_tokens": 6376,
      "completion_tokens": 1015,
      "total_tokens": 7391,
      "usage_status": "reported",
      "accounted_tokens": 7391,
      "finish_reason": "stop",
      "model": "qwen3.6-27b"
    },
    {
      "stage": "manual_case_set__2",
      "repair": false,
      "estimated_input_tokens": 25643,
      "max_output_tokens": 4000,
      "outcome": "succeeded",
      "elapsed_seconds": 24.416,
      "prompt_tokens": 6129,
      "completion_tokens": 597,
      "total_tokens": 6726,
      "usage_status": "reported",
      "accounted_tokens": 6726,
      "finish_reason": "stop",
      "model": "qwen3.6-27b"
    },
    {
      "stage": "manual_case_review__1",
      "repair": false,
      "estimated_input_tokens": 15286,
      "max_output_tokens": 5000,
      "outcome": "succeeded",
      "elapsed_seconds": 9.52,
      "prompt_tokens": 3506,
      "completion_tokens": 177,
      "total_tokens": 3683,
      "usage_status": "reported",
      "accounted_tokens": 3683,
      "finish_reason": "stop",
      "model": "qwen3.6-27b"
    },
    {
      "stage": "manual_case_review__2",
      "repair": false,
      "estimated_input_tokens": 14507,
      "max_output_tokens": 5000,
      "outcome": "succeeded",
      "elapsed_seconds": 6.054,
      "prompt_tokens": 3300,
      "completion_tokens": 67,
      "total_tokens": 3367,
      "usage_status": "reported",
      "accounted_tokens": 3367,
      "finish_reason": "stop",
      "model": "qwen3.6-27b"
    }
  ],
  "usage_summary": {
    "calls": 9,
    "repair_calls": 0,
    "unreported_calls": 0,
    "prompt_tokens": 31014,
    "completion_tokens": 5042,
    "total_tokens": 36056,
    "reported_total_tokens": 36056,
    "accounted_tokens": 36056,
    "budget_tokens": 150000,
    "remaining_tokens": 113944,
    "budget_exhausted": false,
    "estimation_method": "utf8_bytes_plus_256_v1"
  },
  "stop_reason": null,
  "generation": {
    "generation_run_id": "local-20260911T065142Z-f87b0b38",
    "prompt_template_id": "local-design",
    "prompt_template_version": "batched-3",
    "input_sha256": "c9df1767a22b201de071dfaea45989011006ca01f8399ff8fe6ac4c269abb49f",
    "output_schema_id": "local_run_manifest.schema.json",
    "model": {
      "provider": "openai-compatible",
      "name": "qwen3.6-27b",
      "version": null
    },
    "parameters": {
      "temperature": 0.15,
      "seed": null
    },
    "generated_at": "2026-09-11T06:51:42.894610Z",
    "review_status": "pending"
  }
}
